{
  "audit_run_id": "audit:candidate",
  "created_at": "2026-07-27T20:00:00Z",
  "provenance": {
    "actor": {
      "actor_id": "controller:candidate",
      "actor_kind": "controller"
    },
    "created_at": "2026-07-27T20:00:00Z",
    "method": "append_lifecycle_observation"
  },
  "record_type": "audit_run",
  "schema_version": "0.8.0",
  "state": "created"
}
